"DIA","SEM_COMPROMISSO","DURACAO_DIA","INICIO","FIM","DURACAO_COMPROMISSO","TITULO","LOCAL"
"16-07-2021","Não","85","10:40","10:55","15","""Luiz Eduardo Ramos, Ministro de Estado Chefe da Casa Civil da Presidência da República (videoconferência)""","""São Paulo/SP"""
"16-07-2021","Não","85","11:10","11:15","5","""Tarcísio Gomes de Freitas, Ministro de Estado da Infraestrutura (videoconferência)""","""São Paulo/SP"""
"16-07-2021","Não","85","13:40","13:50","10","""Marcos Pontes, Ministro de Estado da Ciência, Tecnologia e Inovações (videoconferência)""","""São Paulo/SP"""
"16-07-2021","Não","85","14:30","14:45","15","""Despacho""","""São Paulo/SP"""
"16-07-2021","Não","85","19:45","20:25","40","""Paulo Guedes, Ministro de Estado da Economia""","""São Paulo/SP"""
